<?xml version="1.0" encoding="UTF-8"?>
<xsd:schema xmlns:xsd="http://www.w3.org/2001/XMLSchema"
    targetNamespace="http://www.imsproject.org/xsd/imscp_rootv1p1p2"
    xmlns="http://www.imsproject.org/xsd/imscp_rootv1p1p2"
    elementFormDefault="qualified">
    <xsd:element name="manifest"/>
    <xsd:element name="organizations"/>
    <xsd:element name="organization"/>
    <xsd:element name="item"/>
    <xsd:element name="resources"/>
    <xsd:element name="resource"/>
    <xsd:element name="file"/>
    <xsd:element name="metadata"/>
    <xsd:element name="title" type="xsd:string"/>
    <xsd:element name="schema" type="xsd:string"/>
    <xsd:element name="schemaversion" type="xsd:string"/>
</xsd:schema>