<?xml version="1.0" encoding="UTF-8"?>
<manifest identifier="SCORM_37d657c7-1f5b-47d5-b36f-92812c5f23dd" version="1.0"
    xmlns="http://www.imsproject.org/xsd/imscp_rootv1p1p2"
    xmlns:adlcp="http://www.adlnet.org/xsd/adlcp_rootv1p2"
    xmlns:xsi="http://www.w3.org/2001/XMLSchema-instance"
    xsi:schemaLocation="http://www.imsproject.org/xsd/imscp_rootv1p1p2 imscp_rootv1p1p2.xsd
                        http://www.imsglobal.org/xsd/imsmd_rootv1p2p1 imsmd_rootv1p2p1.xsd
                        http://www.adlnet.org/xsd/adlcp_rootv1p2 adlcp_rootv1p2.xsd">
    <metadata>
        <schema>ADL SCORM</schema>
        <schemaversion>1.2</schemaversion>
    </metadata>
    <organizations default="org1">
        <organization identifier="org1">
            <title>37d657c7-1f5b-47d5-b36f-92812c5f23dd_Teste de conversor PPT</title>
            <item identifier="item1" identifierref="resource1">
                <title>37d657c7-1f5b-47d5-b36f-92812c5f23dd_Teste de conversor PPT</title>
                <adlcp:masteryscore>80</adlcp:masteryscore>
            </item>
        </organization>
    </organizations>
    <resources>
        <resource identifier="resource1" type="webcontent" adlcp:scormtype="sco" href="index.html">
            <file href="index.html"/>
            <file href="course.json"/>
            <file href="scripts/scorm-api.js"/>
            <file href="scripts/player.js"/>
            <file href="assets/slide_001.png"/>
            <file href="assets/slide_003.png"/>
            <file href="assets/audio_f7cd9ff3-5550-417f-849b-61923d4424bc.webm"/>
            <file href="assets/slide_004.png"/>
            <file href="assets/audio_da367f4a-b02f-47f2-956e-5ba96197563f.mp3"/>
            <file href="assets/slide_002.png"/>
            <file href="assets/global_audio_e211f2a6-c5c1-476f-b1f1-4135c6ee2266.mp3"/>
            <file href="assets/audio_ed4c26af-c35d-4aad-b936-98857d48c59c.webm"/>
            <file href="assets/audio_6db05710-3610-4c06-9a3b-9a3ed72bb498.webm"/>
            <file href="assets/6f6c9eae-720a-4771-9179-3432049f2e9b.png"/>
            <file href="assets/audio_8c6b3918-c0c8-4e5b-b036-fe6968b13fb9.webm"/>
        </resource>
    </resources>
</manifest>