<?xml version="1.0" encoding="UTF-8"?>
<manifest identifier="SCORM_2aed424b-2453-4d0c-9850-6bc5d3b27d97" version="1.0"
    xmlns="http://www.imsproject.org/xsd/imscp_rootv1p1p2"
    xmlns:adlcp="http://www.adlnet.org/xsd/adlcp_rootv1p2"
    xmlns:xsi="http://www.w3.org/2001/XMLSchema-instance"
    xsi:schemaLocation="http://www.imsproject.org/xsd/imscp_rootv1p1p2 imscp_rootv1p1p2.xsd
                        http://www.imsglobal.org/xsd/imsmd_rootv1p2p1 imsmd_rootv1p2p1.xsd
                        http://www.adlnet.org/xsd/adlcp_rootv1p2 adlcp_rootv1p2.xsd">
    <metadata>
        <schema>ADL SCORM</schema>
        <schemaversion>1.2</schemaversion>
    </metadata>
    <organizations default="org1">
        <organization identifier="org1">
            <title>PptxGenJS Presentation</title>
            <item identifier="item1" identifierref="resource1">
                <title>PptxGenJS Presentation</title>
                <adlcp:masteryscore>80</adlcp:masteryscore>
            </item>
        </organization>
    </organizations>
    <resources>
        <resource identifier="resource1" type="webcontent" adlcp:scormtype="sco" href="index.html">
            <file href="index.html"/>
            <file href="course.json"/>
            <file href="scripts/scorm-api.js"/>
            <file href="scripts/quiz-controller.js"/>
            <file href="scripts/player.js"/>
            <file href="assets/slide_011.png"/>
            <file href="assets/video_ca6cfd21a2e9.webm"/>
            <file href="assets/slide_001.png"/>
            <file href="assets/slide_003.png"/>
            <file href="assets/slide_005.png"/>
            <file href="assets/slide_010.png"/>
            <file href="assets/slide_004.png"/>
            <file href="assets/slide_002.png"/>
            <file href="assets/slide_007.png"/>
            <file href="assets/slide_008.png"/>
            <file href="assets/slide_009.png"/>
            <file href="assets/global_audio_3577a6de-5318-4f71-9db7-09e8de7898aa.mp3"/>
            <file href="assets/45c84910-0336-44e3-8f45-0225ca1cdf92.png"/>
            <file href="assets/slide_006.png"/>
            <file href="assets/video_2f729e2c7219.webm"/>
        </resource>
    </resources>
</manifest>