<?xml version="1.0" encoding="UTF-8"?>
<manifest identifier="SCORM_58753bb1-60a3-4190-8de3-ca51203e8f4d" version="1.0"
    xmlns="http://www.imsproject.org/xsd/imscp_rootv1p1p2"
    xmlns:adlcp="http://www.adlnet.org/xsd/adlcp_rootv1p2"
    xmlns:xsi="http://www.w3.org/2001/XMLSchema-instance"
    xsi:schemaLocation="http://www.imsproject.org/xsd/imscp_rootv1p1p2 imscp_rootv1p1p2.xsd
                        http://www.imsglobal.org/xsd/imsmd_rootv1p2p1 imsmd_rootv1p2p1.xsd
                        http://www.adlnet.org/xsd/adlcp_rootv1p2 adlcp_rootv1p2.xsd">
    <metadata>
        <schema>ADL SCORM</schema>
        <schemaversion>1.2</schemaversion>
    </metadata>
    <organizations default="org1">
        <organization identifier="org1">
            <title>Demo SCORMIFY completo</title>
            <item identifier="item1" identifierref="resource1">
                <title>Demo SCORMIFY completo</title>
                <adlcp:masteryscore>80</adlcp:masteryscore>
            </item>
        </organization>
    </organizations>
    <resources>
        <resource identifier="resource1" type="webcontent" adlcp:scormtype="sco" href="index.html">
            <file href="index.html"/>
            <file href="course.json"/>
            <file href="scripts/scorm-api.js"/>
            <file href="scripts/quiz-controller.js"/>
            <file href="scripts/player.js"/>
            <file href="assets/f96f0247-09a2-4d0d-8391-d33ca6a85506.png"/>
            <file href="assets/59701cbc-85dc-4293-8e9c-a1e232432b09.png"/>
            <file href="assets/55891c08-df36-4d1e-80aa-d16584f1f11e.png"/>
            <file href="assets/ba64e6f8-57f9-4f82-b67e-c93e59934ed5.png"/>
            <file href="assets/3d16a601-662c-4d2e-8b08-90b55f8b94a3.png"/>
            <file href="assets/4fb59014-d495-43c9-8179-ad6f8523cb28.jpg"/>
            <file href="assets/006ff336-0049-4d1d-ab25-dd9928ea32b1.jpg"/>
            <file href="assets/a80b9d93-59b5-4cda-8f72-c42c8314de94.jpg"/>
            <file href="assets/2c0e3315-ed50-4650-8113-5d587a3b7c75.png"/>
            <file href="assets/048bd1e5-d4c1-4584-b5c0-a729faef514a.jpg"/>
            <file href="assets/0e787e8e-8427-4391-a30b-f443a1637df7.jpg"/>
            <file href="assets/569c7e20-c75f-4a57-bbe5-0f5ec5443edb.png"/>
            <file href="assets/9a232602-92a3-43a6-a9ef-0de0ed5a6b8e.jpg"/>
            <file href="assets/d6e13e3e-dd06-4aa4-acaf-249e3aafdeb4.png"/>
            <file href="assets/841a4ce8-84d8-4691-acac-401e7919769c.png"/>
            <file href="assets/6ff438fc-9a1d-4947-9579-3c164b9968f8.png"/>
            <file href="assets/9f7410b7-35db-4cb6-b962-93f087761108.jpg"/>
            <file href="assets/9cb74a07-b372-48ad-b463-6121c7ddaf97.jpg"/>
            <file href="assets/eda15588-52e2-4d6d-a7f8-fef37f21832f.png"/>
            <file href="assets/a164da20-7d5c-48ce-80f6-5420496fabdc.png"/>
            <file href="assets/e82f60b5-5627-4a3c-995d-f743c0b3b0c0.png"/>
            <file href="assets/6dd259b6-83d4-40fb-88c3-562457078924.png"/>
            <file href="assets/9640efb5-3094-4b70-8748-e9e65762d442.png"/>
            <file href="assets/78136a9d-7fa7-4ee6-80ed-0dda5cf40cae.png"/>
            <file href="assets/1bb6ea09-8883-4bcd-ae15-d2a4c6c57457.jpg"/>
            <file href="assets/5d13dde2-4200-43ef-83e9-3fe535b09417.png"/>
            <file href="assets/27d5dbaf-b9fb-48b8-9b24-38b7982fbbdb.jpg"/>
            <file href="assets/23ee1c2c-6cd0-4623-ad9d-5647e0cb084b.jpg"/>
            <file href="assets/d6e16721-128f-49ab-9852-b732fcc1508b.jpg"/>
            <file href="assets/73aa07d2-c201-4fe2-9d68-1efd04d99c3e.png"/>
            <file href="assets/audio_d2154dd7-f5a9-4e02-876e-41d63b20f953.mp3"/>
            <file href="assets/64b6f410-131c-4a7c-8a84-5f19f0c206b6.png"/>
            <file href="assets/5fdd533c-160f-4308-8f56-6080436fe6af.png"/>
        </resource>
    </resources>
</manifest>